{"diagnostics":[{"evidence":[{"label":"function","value":"Route"},{"label":"complexity","value":"3"}],"file":"router.go","fix":null,"help":"Split deeply branched behavior into smaller focused functions.","labels":[],"message":"Go function `Route` has cyclomatic complexity 3, max 1.","range":{"end_col":2,"end_line":17,"start_col":1,"start_line":7},"rule_id":"local/go-cyclomatic-complexity","severity":"warn","stable_fingerprint":"0a2314fead7c1884","suggestions":[]}],"schema":"https://raw.githubusercontent.com/emilwareus/polint/main/docs/schemas/polint-report-v1.json","tool":{"name":"polint","version":"<stripped>"},"version":1}
