{"diagnostics":[{"evidence":[{"label":"condition","value":"err != nil"},{"label":"branch_fingerprint","value":"59289caa933edad6"}],"file":"authorize.go","fix":null,"help":"This is a repo-local heuristic: it checks nearby extracted test facts, not exact coverage.","labels":[],"message":"Add a companion test for this Go error branch.","range":{"end_col":15,"end_line":8,"start_col":5,"start_line":8},"rule_id":"local/require-error-branch-tests","severity":"warn","stable_fingerprint":"aa8bb8d70334ca3e","suggestions":[]}],"schema":"https://raw.githubusercontent.com/emilwareus/polint/main/docs/schemas/polint-report-v1.json","tool":{"name":"polint","version":"<stripped>"},"version":1}
