{"diagnostics":[{"evidence":[{"label":"literal","value":"#ff00aa"},{"label":"source","value":"jsx-attribute"}],"file":"Button.tsx","fix":null,"help":"Move this value to a theme/design-token file or use an existing token.","labels":[],"message":"Raw color literal `#ff00aa` should use a design token.","range":{"end_col":38,"end_line":6,"start_col":18,"start_line":6},"rule_id":"local/no-raw-colors","severity":"error","stable_fingerprint":"045fbb3f0c7f6401","suggestions":[]},{"evidence":[{"label":"literal","value":"#ff00aa"},{"label":"source","value":"string-literal"}],"file":"Button.tsx","fix":null,"help":"Move this value to a theme/design-token file or use an existing token.","labels":[],"message":"Raw color literal `#ff00aa` should use a design token.","range":{"end_col":38,"end_line":6,"start_col":29,"start_line":6},"rule_id":"local/no-raw-colors","severity":"error","stable_fingerprint":"cb86ff4f9aae8879","suggestions":[]}],"schema":"https://raw.githubusercontent.com/emilwareus/polint/main/docs/schemas/polint-report-v1.json","tool":{"name":"polint","version":"<stripped>"},"version":1}
