{"diagnostics":[{"evidence":[{"label":"literal","value":"legacy-testid"},{"label":"matched","value":"legacy-testid"}],"file":"app.ts","fix":null,"help":"Replace the literal or add a narrow, reasoned ignore.","labels":[],"message":"Configured denied literal `legacy-testid` found.","range":{"end_col":43,"end_line":6,"start_col":28,"start_line":6},"rule_id":"local/no-denied-literals","severity":"warn","stable_fingerprint":"f95ca95afc2b520e","suggestions":[]}],"schema":"https://raw.githubusercontent.com/emilwareus/polint/main/docs/schemas/polint-report-v1.json","tool":{"name":"polint","version":"<stripped>"},"version":1}
